{
  "version": "1.0.0",
  "section": 89,
  "slug": "maintenance-bay-infiltration",
  "canonical_filename": "relay-b006.webp",
  "placement_hint": "inline-after-paragraph-1",
  "prompt": "Wide shot of Kestrel Station's maintenance bay—gantries over mist, hazard strobes, two figures slipping through.",
  "alt_caption": "Rhea and Ix ghost across the catwalks as the Relay thrums."
}
